{
  "schema": "ucc.repository",
  "schema_version": 1,
  "id": "col_01K0A6R4V8W6E3M4M8Y0R9J2QR",
  "created_at": "2026-08-22T12:00:00.000Z",
  "created_by": "act_01K0A6R4V8W6E3M4M8Y0R9J2QA",
  "record_version": 1,
  "name": "core-repo",
  "remote_url": "git@github.com:Eo-org24/nodectl.git",
  "credential_ref": "cred_01K0A6R4V8W6E3M4M8Y0R9J2QC",
  "default_branch": "ucc-integration"
}
